{
  "no_action": {
    "start": [
      2,
      48,
      82,
      102,
      271,
      298,
      327,
      353,
      383,
      515,
      543,
      577,
      600,
      624,
      646,
      694,
      751,
      791,
      810,
      836,
      857,
      881,
      902,
      917,
      930
    ],
    "end": [
      30,
      66,
      89,
      256,
      283,
      314,
      337,
      367,
      501,
      529,
      557,
      587,
      614,
      636,
      681,
      733,
      777,
      798,
      820,
      843,
      869,
      892,
      909,
      925,
      938
    ]
  },
  "get_connectors": {
    "start": [
      0,
      31,
      67,
      90,
      615,
      637,
      682,
      734
    ],
    "end": [
      1,
      47,
      81,
      101,
      623,
      645,
      693,
      750
    ]
  },
  "get_screws": {
    "start": [
      257,
      284,
      315,
      338,
      502,
      530,
      558,
      588,
      778,
      799,
      821,
      844
    ],
    "end": [
      270,
      297,
      326,
      352,
      514,
      542,
      576,
      599,
      790,
      809,
      835,
      856
    ]
  },
  "get_wheels": {
    "start": [
      870,
      893,
      910,
      926
    ],
    "end": [
      880,
      901,
      916,
      929
    ]
  },
  "ignore": {
    "start": [
      368,
      939
    ],
    "end": [
      382,
      949
    ]
  }
}
