{
  "no_action": {
    "start": [
      26,
      64,
      134,
      202,
      222,
      295,
      358,
      384,
      416,
      449
    ],
    "end": [
      49,
      121,
      200,
      208,
      281,
      344,
      371,
      399,
      435,
      462
    ]
  },
  "get_connectors": {
    "start": [
      50,
      122,
      201,
      209,
      282
    ],
    "end": [
      63,
      133,
      201,
      221,
      294
    ]
  },
  "get_screws": {
    "start": [
      345,
      372,
      400,
      436
    ],
    "end": [
      357,
      383,
      415,
      448
    ]
  },
  "get_wheels": {
    "start": [],
    "end": []
  },
  "ignore": {
    "start": [
      0,
      463
    ],
    "end": [
      25,
      491
    ]
  }
}
